{
  "$schema": "./schema/dart-tooling-compatibility.schema.json",
  "formatVersion": 1,
  "phase": "phase-2b-dart-tooling",
  "implementationCommit": "pending-main-merge",
  "dartSdkConstraint": "^3.6.0",
  "sources": [
    {
      "sourceId": "lsp-3.18-b7f5132",
      "protocols": [
        "lsp"
      ],
      "release": "3.18-audit-snapshot",
      "revision": "b7f5132c95261c0898ae5124e7a91707abc48fcd",
      "artifactRefs": [
        "lsp-meta-model",
        "lsp-meta-model-schema",
        "lsp-meta-model-typescript",
        "lsp-license",
        "lsp-code-license"
      ],
      "profiles": {
        "stable": "3.17 overlap",
        "proposed": "3.18 explicit opt-in only"
      }
    },
    {
      "sourceId": "dap-v1.71.0",
      "protocols": [
        "dap"
      ],
      "release": "v1.71.0",
      "revision": "51d95ea4e692b34c5d06601bbd1bebc1ff3fbdd4",
      "artifactRefs": [
        "dap-schema",
        "dap-license",
        "dap-code-license"
      ],
      "profiles": {
        "schemaVersion": "1.71.0"
      }
    },
    {
      "sourceId": "dart-3.6.0",
      "protocols": [
        "analysis-server",
        "dtd",
        "vm-service"
      ],
      "release": "3.6.0",
      "revision": "ae7ca5199a0559db0ae60533e9cedd3ce0d6ab04",
      "artifactRefs": [
        "dart-3.6.0-analysis-spec",
        "dart-3.6.0-analysis-api",
        "dart-3.6.0-analysis-generated",
        "dart-3.6.0-analysis-constants",
        "dart-3.6.0-dtd-protocol",
        "dart-3.6.0-vm-service",
        "dart-3.6.0-vm-generated",
        "dart-3.6.0-vm-runtime-version",
        "dart-sdk-license"
      ],
      "profiles": {
        "analysisServerApi": "1.38.0",
        "dtdInventory": "dtd-fixed-inventory-v1",
        "vmService": "4.16"
      }
    },
    {
      "sourceId": "dart-3.12.2",
      "protocols": [
        "analysis-server",
        "dtd",
        "vm-service"
      ],
      "release": "3.12.2",
      "revision": "d684a576a6aa954ae107a03b2b4e1d61c3bebe93",
      "artifactRefs": [
        "dart-3.12.2-analysis-spec",
        "dart-3.12.2-analysis-api",
        "dart-3.12.2-analysis-generated",
        "dart-3.12.2-analysis-constants",
        "dart-3.12.2-dtd-protocol",
        "dart-3.12.2-vm-service",
        "dart-3.12.2-vm-generated",
        "dart-3.12.2-vm-runtime-version"
      ],
      "profiles": {
        "analysisServerApi": "1.40.1",
        "dtdInventory": "dtd-fixed-inventory-v1",
        "vmService": "4.21"
      }
    }
  ],
  "peerProfiles": [
    {
      "id": "dart-test-current",
      "family": "dart-sdk",
      "role": "unit-contract",
      "release": "3.12.2",
      "revision": "d684a576a6aa954ae107a03b2b4e1d61c3bebe93",
      "platform": "macos-arm64",
      "transport": "in-process"
    },
    {
      "id": "dart-sdk-minimum",
      "family": "dart-sdk",
      "role": "portability",
      "release": "3.6.0",
      "revision": "ae7ca5199a0559db0ae60533e9cedd3ce0d6ab04",
      "platform": "macos-arm64",
      "transport": "vm-js-wasm"
    },
    {
      "id": "dart-sdk-current",
      "family": "dart-sdk",
      "role": "portability",
      "release": "3.12.2",
      "revision": "d684a576a6aa954ae107a03b2b4e1d61c3bebe93",
      "platform": "macos-arm64",
      "transport": "vm-chrome-js-wasm"
    },
    {
      "id": "lsp-dart-minimum",
      "family": "dart-language-server",
      "role": "lsp",
      "release": "3.6.0",
      "revision": "ae7ca5199a0559db0ae60533e9cedd3ce0d6ab04",
      "platform": "macos-arm64",
      "transport": "stdio-content-length",
      "observedProtocol": "LSP stable overlap"
    },
    {
      "id": "lsp-dart-current",
      "family": "dart-language-server",
      "role": "lsp",
      "release": "3.12.2",
      "revision": "d684a576a6aa954ae107a03b2b4e1d61c3bebe93",
      "platform": "macos-arm64",
      "transport": "stdio-content-length",
      "observedProtocol": "LSP stable overlap"
    },
    {
      "id": "lsp-typescript-5.3.0",
      "family": "typescript-language-server",
      "role": "lsp",
      "release": "5.3.0+typescript-6.0.3",
      "revision": "589044479e4bc2bffb796b593242136f5323b582",
      "platform": "macos-arm64",
      "transport": "stdio-content-length",
      "observedProtocol": "LSP stable overlap"
    },
    {
      "id": "dap-dart-minimum",
      "family": "dart-debug-adapter",
      "role": "dap",
      "release": "3.6.0",
      "revision": "ae7ca5199a0559db0ae60533e9cedd3ce0d6ab04",
      "platform": "macos-arm64",
      "transport": "stdio-content-length",
      "observedProtocol": "DAP 1.x"
    },
    {
      "id": "dap-dart-current",
      "family": "dart-debug-adapter",
      "role": "dap",
      "release": "3.12.2",
      "revision": "d684a576a6aa954ae107a03b2b4e1d61c3bebe93",
      "platform": "macos-arm64",
      "transport": "stdio-content-length",
      "observedProtocol": "DAP 1.x"
    },
    {
      "id": "dap-js-debug-1.117.0",
      "family": "vscode-js-debug",
      "role": "dap",
      "release": "1.117.0",
      "revision": "496a6f1a4fc8198bcd563f97b84a07aa39917404",
      "platform": "macos-arm64",
      "transport": "tcp-content-length",
      "observedProtocol": "DAP 1.x"
    },
    {
      "id": "analysis-server-minimum",
      "family": "dart-analysis-server",
      "role": "analysis-server",
      "release": "3.6.0",
      "revision": "ae7ca5199a0559db0ae60533e9cedd3ce0d6ab04",
      "platform": "macos-arm64",
      "transport": "stdio-json",
      "observedProtocol": "1.38.0"
    },
    {
      "id": "analysis-server-current",
      "family": "dart-analysis-server",
      "role": "analysis-server",
      "release": "3.12.2",
      "revision": "d684a576a6aa954ae107a03b2b4e1d61c3bebe93",
      "platform": "macos-arm64",
      "transport": "stdio-json",
      "observedProtocol": "1.40.1"
    },
    {
      "id": "dtd-minimum",
      "family": "dart-dtd",
      "role": "dtd",
      "release": "3.6.0",
      "revision": "ae7ca5199a0559db0ae60533e9cedd3ce0d6ab04",
      "platform": "macos-arm64",
      "transport": "websocket-json-rpc"
    },
    {
      "id": "dtd-current",
      "family": "dart-dtd",
      "role": "dtd",
      "release": "3.12.2",
      "revision": "d684a576a6aa954ae107a03b2b4e1d61c3bebe93",
      "platform": "macos-arm64",
      "transport": "websocket-json-rpc"
    },
    {
      "id": "vm-service-minimum",
      "family": "dart-vm-service",
      "role": "vm-service",
      "release": "3.6.0",
      "revision": "ae7ca5199a0559db0ae60533e9cedd3ce0d6ab04",
      "platform": "macos-arm64",
      "transport": "websocket-json-rpc",
      "observedProtocol": "4.16"
    },
    {
      "id": "vm-service-current",
      "family": "dart-vm-service",
      "role": "vm-service",
      "release": "3.12.2",
      "revision": "d684a576a6aa954ae107a03b2b4e1d61c3bebe93",
      "platform": "macos-arm64",
      "transport": "websocket-json-rpc",
      "observedProtocol": "4.21"
    }
  ],
  "claims": [
    {
      "claimId": "P2B-LSP-01",
      "protocol": "lsp",
      "surface": "source-and-generated-union",
      "level": "implemented",
      "role": "codec",
      "transport": "json",
      "sourceRefs": [
        "lsp-3.18-b7f5132"
      ],
      "runtimeVersionPolicy": "lsp-3.18-audit-snapshot",
      "peerScope": "in-process",
      "platform": "portable-dart",
      "evidenceIds": [
        "EV-P2B-LSP-01"
      ],
      "implementationCommit": "pending-main-merge",
      "evidenceCommit": "pending-main-merge",
      "limitations": [
        "KU-P2B-LSP-PROPOSED"
      ]
    },
    {
      "claimId": "P2B-LSP-02",
      "protocol": "lsp",
      "surface": "stable-codec-and-open-values",
      "level": "implemented",
      "role": "codec",
      "transport": "json-rpc",
      "sourceRefs": [
        "lsp-3.18-b7f5132"
      ],
      "runtimeVersionPolicy": "lsp-stable-overlap",
      "peerScope": "in-process",
      "platform": "portable-dart",
      "evidenceIds": [
        "EV-P2B-LSP-02"
      ],
      "implementationCommit": "pending-main-merge",
      "evidenceCommit": "pending-main-merge",
      "limitations": []
    },
    {
      "claimId": "P2B-LSP-03",
      "protocol": "lsp",
      "surface": "lifecycle-correlation-cancellation",
      "level": "implemented",
      "role": "client",
      "transport": "caller-owned",
      "sourceRefs": [
        "lsp-3.18-b7f5132"
      ],
      "runtimeVersionPolicy": "lsp-stable-overlap",
      "peerScope": "in-process",
      "platform": "portable-dart",
      "evidenceIds": [
        "EV-P2B-LSP-03"
      ],
      "implementationCommit": "pending-main-merge",
      "evidenceCommit": "pending-main-merge",
      "limitations": [
        "KU-P2B-AGENT-RECONNECT"
      ]
    },
    {
      "claimId": "P2B-LSP-04",
      "protocol": "lsp",
      "surface": "capability-and-dynamic-registration",
      "level": "implemented",
      "role": "client",
      "transport": "caller-owned",
      "sourceRefs": [
        "lsp-3.18-b7f5132"
      ],
      "runtimeVersionPolicy": "lsp-stable-overlap",
      "peerScope": "in-process",
      "platform": "portable-dart",
      "evidenceIds": [
        "EV-P2B-LSP-04"
      ],
      "implementationCommit": "pending-main-merge",
      "evidenceCommit": "pending-main-merge",
      "limitations": []
    },
    {
      "claimId": "P2B-LSP-05",
      "protocol": "lsp",
      "surface": "document-sync-and-content-version",
      "level": "implemented",
      "role": "client",
      "transport": "caller-owned",
      "sourceRefs": [
        "lsp-3.18-b7f5132"
      ],
      "runtimeVersionPolicy": "lsp-stable-overlap",
      "peerScope": "in-process",
      "platform": "portable-dart",
      "evidenceIds": [
        "EV-P2B-LSP-05"
      ],
      "implementationCommit": "pending-main-merge",
      "evidenceCommit": "pending-main-merge",
      "limitations": []
    },
    {
      "claimId": "P2B-LSP-06",
      "protocol": "lsp",
      "surface": "reverse-request-proposals",
      "level": "implemented",